place,title,time,pay,date
경북 포항시, 세븐일레븐 포항대잠중앙점,22:00~09:00,"시급8,720",1분전
서울 전체, 세븐일레븐 청계을지로3가점,19:00~02:00,"시급8,720",1분전
경기 수원시, 세븐일레븐 수원고색중앙점,15:00~21:00,"시급8,720",1분전
경기 평택시, 세븐일레븐 평택청북부영점,16:00~22:00,"시급8,720",5분전
부산 서구, 세븐일레븐 부산서구동대신점,14:00~21:00,"시급8,720",5분전
강원 춘천시, 세븐일레븐 춘천만천쉼터점,14:30~20:30,"시급8,720",5분전
서울 영등포, 세븐일레븐 영등포동우점,23:00~06:00,"시급8,720",6분전
인천 계양구, 세븐일레븐 인천임학역,23:00~07:00,"시급8,720",6분전
강원 춘천시, 세븐일레븐 춘천만천쉼터점,20:00~00:30,"시급8,720",6분전
전남 여수시, 세븐일레븐 여수돌산라온점,16:00~22:30,"시급8,720",7분전
대전 서구, 세븐일레븐 대전경남점,22:00~09:00,"시급8,720",8분전
전북 전주시, 세븐일레븐 전주신동아점,24:00~07:00,"시급8,720",9분전
서울 영등포, 세븐일레븐 여의금강점,17:00~22:00,"시급8,720",9분전
경기 광주시, 세븐일레븐 경기광주참조은점,15:00~23:00,"시급8,720",9분전
경기 부천시, 세븐일레븐 부천삼정공단점,06:00~18:00,"시급8,900",9분전
서울 중구, 세븐일레븐 세종대로카페점,22:00~08:00,"시급8,720",10분전
서울 전체, 세븐일레븐 목동힐스테이트점,23:00~06:00,"시급8,900",12분전
경기 수원시, 세븐일레븐 수원능실마을점,23:00~06:00,"시급8,720",12분전
세종 금남면, 세븐일레븐 연기금남용포점,22:00~08:00,"시급8,720",12분전
대전 유성구, 세븐일레븐 대전진잠타운점,11:00~16:00,"시급8,720",13분전
인천 계양구, 세븐일레븐 인천임학역,23:00~07:00,"시급8,720",13분전
경기 성남시, 세븐일레븐 분당불정점,시간협의,"시급8,720",14분전
대구 남구, 세븐일레븐 대명행복점,19:00~22:00,"건별8,590",14분전
세종 금남면, 세븐일레븐 연기금남용포점,22:00~08:00,"시급8,720",14분전
대전 서구, 세븐일레븐 대전경남점,16:00~23:00,"시급8,720",16분전
부산 남구, 세븐일레븐 부산문현데시앙점,22:00~08:00,"시급8,720",16분전
서울 중구, 세븐일레븐 세종대로카페점,08:00~13:00,"시급8,720",17분전
경기 여주시, 세븐일레븐 여주흥천본점,03:30~22:30,"시급8,720",17분전
강원 원주시, 세븐일레븐 원주명륜원룸점,18:00~21:00,"시급8,720",18분전
대구 달서구, 세븐일레븐 대구월성효성점,시간협의,"월급416,000",18분전
서울 중구, 세븐일레븐 명동롯데점,22:00~08:00,"시급8,720",18분전
광주 서구, 세븐일레븐 광주상무번영점,24:00~08:00,"시급8,720",19분전
인천 서구, 세븐일레븐 당하제일점,08:00~14:00,"시급8,720",19분전
서울 관악구, 세븐일레븐 관악웰피아점,시간협의,"월급1,750,000",19분전
전남 여수시, 세븐일레븐 여수학동선소점,08:00~17:00,"시급8,720",20분전
경북 경산시, 세븐일레븐 대구대기숙사점,18:00~24:00,"시급8,720",20분전
인천 남동구, 세븐일레븐 인천간석2호점,00:00~06:00,"시급8,720",20분전
서울 관악구, 세븐일레븐 관악웰피아점,시간협의,"월급1,750,000",20분전
광주 전체, 세븐일레븐 광주광천터미널직행점,15:00~20:00,"시급8,720",20분전
전남 여수시, 세븐일레븐 여수신기점,24:00~08:00,"시급8,720",21분전
충북 청주시, 세븐일레븐 청주오창부영점,15:30~18:30,"시급8,720",22분전
대전 유성구, 세븐일레븐 대전진잠타운점,21:00~02:00,"시급8,720",25분전
충남 천안시, 세븐일레븐 천인직산점,23:00~09:00,"시급8,720",26분전
전북 남원시, 세븐일레븐 남원도통점,22:00~08:00,"시급8,720",26분전
서울 관악구, 세븐일레븐 관악봉천로점,14:00~19:00,"시급8,720",26분전
경북 경산시, 세븐일레븐 대구대기숙사점,11:00~18:00,"시급8,720",27분전
서울 관악구, 세븐일레븐 관악대성점,23:00~08:00,"시급8,720",28분전
대전 유성구, 세븐일레븐 대전진잠타운점,11:00~16:00,"시급8,720",28분전
부산 사하구, 세븐일레븐 부산장림스마트점,15:00~23:00,"시급8,720",28분전
충남 부여군, 세븐일레븐 부여리조트점,07:00~01:00,"시급8,720",29분전
